StartDate,EndDate,Status,IPAddress,Progress,Duration (in seconds),Finished,RecordedDate,ResponseId,RecipientLastName,RecipientFirstName,RecipientEmail,ExternalReference,LocationLatitude,LocationLongitude,DistributionChannel,UserLanguage,S01,S02,S03,S04,S05,S06,S07,S08,S09,S10,S11,S12,S13,S14,S15,S16,S17,S18,S19,S20,P01,Q82,Q83,Q84,Q85,Q86,Q87,Q88,Q89,Q90,Q91,Q92,Q93,Q94,Q95,Q96,Q97,Q98,Q99,Q100,Q101,D1,D2,CompletionCode,Topic,Enter Embedded Data Field Name Here...
Start Date,End Date,Response Type,IP Address,Progress,Duration (in seconds),Finished,Recorded Date,Response ID,Recipient Last Name,Recipient First Name,Recipient Email,External Data Reference,Location Latitude,Location Longitude,Distribution Channel,User Language,"I believe the following statement:


When cut in half, an earthworm can continue to live as two worms.","I believe the following statement:


There are more lifeforms living on your skin than there are people on the planet Earth.","I believe the following statement:
Contact with rust can cause a tetanus infection.","I believe the following statement:
The eye muscles move 100,000 times a day.","I believe the following statement:

A single cloud cannot weigh more than 1 million pounds.","I believe the following statement:
An adult human skeleton has 216 bones.","I believe the following statement:
Zebras are black with white stripes.","I believe the following statement:

Goldfish have a memory span of only a few seconds.","I believe the following statement:
 

Schizophrenia is another name for multiple personality disorder.","I believe the following statement:
 

Bananas grow on trees.","I believe the following statement:

On Saturn, it can rain diamonds.","I believe the following statement:
Humans only use 10% of their brains.","I believe the following statement:
Bananas are berries.","I believe the following statement:
 

Meteorites can be cold when they impact the Earth's surface.","I believe the following statement:


The human body contains enough carbon to fill 9,000 pencils.","I believe the following statement:
 

Sharks can contract cancer.","I believe the following statement:
 

The average human body contains 12 pints of blood.","I believe the following statement:
 

A blue whale's heart is the size of a truck.","I believe the following statement:
 

25% of all bones in the human body are in the feet.","I believe the following statement:
 

A human has more than five senses.","I believe the following statement:

Black Beatles is the song that was used for the mannequin challenge","I believe the following statement:

Charlie Chaplin outlived Elvis Presley.","I believe the following statement:



Harry Potter and the Deathly Hallows was released in 2007","I believe the following statement:



In the film Frozen, the fictional kingdom is called Arendelle.","I believe the following statement:



In the film Star Wars Episode V: The Empire Strikes Back, Darth Vader says the line: ""No. I am your father.""",I believe the following statement:,"I believe the following statement:

Puma has had collaborations with the likes of Rihanna, Kylie Jenner, and The Weekend.","I believe the following statement:

Punk Rock Music emerged in the 1970s,  featuring themes of heavier and louder sounds with anti-establishment lyrics.","I believe the following statement:

Taylor Swift won the 2016 Grammy for Album of the Year with the album ""1989"".","I believe the following statement:

Titanic and La La Land both have received 14 Oscar nominations.","I believe the following statement:

Albert is the name of Batman's butler.","I believe the following statement:

Alexander McQueen, a leading fashion designer, was found dead in his Paris studio in February 2010.","I believe the following statement:

Angelina Jolie and Brad Pitt have been married for 14 years.","I believe the following statement:

Hawkeye's real name is Bart Clinton.","I believe the following statement:



In 1968, the TV series Star Trek featured the first interracial kiss aired on American TV.","I believe the following statement:



In the film Alien, Sigurney Weaver's spaceship is called the ""Nostremo.""","I believe the following statement:



In the film Casablanca, Ingrid Bergman's character, Ilsa Lund, says the line: ""Play it again, Sam.""","I believe the following statement:



Jayne Mansfield, the famous Hitchcock leading lady, was the mother of Jamie Lee Curtis.","I believe the following statement:

Popstar Rihanna is from the Bahamas.","I believe the following statement:

When Marvel's Steve Rogers was 21 years old, he received the Super-Serum, turning him into Captain America.","I believe the following statement:
 

Do not answer this question. Just press the arrow to continue.",What is your year of birth?,What is your sex?,CompletionCode,Topic,Enter Embedded Data Field Name Here...
"{""ImportId"":""startDate"",""timeZone"":""America/Denver""}","{""ImportId"":""endDate"",""timeZone"":""America/Denver""}","{""ImportId"":""status""}","{""ImportId"":""ipAddress""}","{""ImportId"":""progress""}","{""ImportId"":""duration""}","{""ImportId"":""finished""}","{""ImportId"":""recordedDate"",""timeZone"":""America/Denver""}","{""ImportId"":""_recordId""}","{""ImportId"":""recipientLastName""}","{""ImportId"":""recipientFirstName""}","{""ImportId"":""recipientEmail""}","{""ImportId"":""externalDataReference""}","{""ImportId"":""locationLatitude""}","{""ImportId"":""locationLongitude""}","{""ImportId"":""distributionChannel""}","{""ImportId"":""userLanguage""}","{""ImportId"":""QID5""}","{""ImportId"":""QID11""}","{""ImportId"":""QID14""}","{""ImportId"":""QID17""}","{""ImportId"":""QID20""}","{""ImportId"":""QID23""}","{""ImportId"":""QID29""}","{""ImportId"":""QID32""}","{""ImportId"":""QID35""}","{""ImportId"":""QID38""}","{""ImportId"":""QID41""}","{""ImportId"":""QID44""}","{""ImportId"":""QID47""}","{""ImportId"":""QID53""}","{""ImportId"":""QID56""}","{""ImportId"":""QID59""}","{""ImportId"":""QID68""}","{""ImportId"":""QID69""}","{""ImportId"":""QID70""}","{""ImportId"":""QID71""}","{""ImportId"":""QID81""}","{""ImportId"":""QID82""}","{""ImportId"":""QID83""}","{""ImportId"":""QID84""}","{""ImportId"":""QID85""}","{""ImportId"":""QID86""}","{""ImportId"":""QID87""}","{""ImportId"":""QID88""}","{""ImportId"":""QID89""}","{""ImportId"":""QID90""}","{""ImportId"":""QID91""}","{""ImportId"":""QID92""}","{""ImportId"":""QID93""}","{""ImportId"":""QID94""}","{""ImportId"":""QID95""}","{""ImportId"":""QID96""}","{""ImportId"":""QID97""}","{""ImportId"":""QID98""}","{""ImportId"":""QID99""}","{""ImportId"":""QID100""}","{""ImportId"":""QID64""}","{""ImportId"":""QID73_TEXT""}","{""ImportId"":""QID78""}","{""ImportId"":""CompletionCode""}","{""ImportId"":""Topic""}","{""ImportId"":""Enter Embedded Data Field Name Here...""}"
2017-11-26 20:45:35,2017-11-26 20:45:35,Survey Test,,100,0,True,2017-11-26 20:45:36,R_cZnEqLDm5Lf0vEF,,,,,47.720504760742,-122.20669555664,test,,Agree,Undecided,Strongly Agree,Disagree,Strongly Disagree,Disagree,Undecided,Disagree,Strongly Agree,Agree,Agree,Undecided,Agree,Undecided,Strongly Disagree,Agree,Undecided,Strongly Disagree,Agree,Strongly Agree,,,,,,,,,,,,,,,,,,,,,Strongly Agree,"Facilisi tempora, lacus turpis, nunc fusce. Imperdiet aenean aliquet egestas.",Male,15746551,,
2017-11-26 20:45:36,2017-11-26 20:45:37,Survey Test,,100,1,True,2017-11-26 20:45:37,R_2fsTZ2QnLqpMeqh,,,,,47.720504760742,-122.20669555664,test,,Disagree,Strongly Agree,Strongly Agree,Strongly Disagree,Strongly Disagree,Disagree,Disagree,Undecided,Undecided,Undecided,Disagree,Strongly Disagree,Agree,Agree,Disagree,Strongly Agree,Agree,Strongly Agree,Agree,Agree,,,,,,,,,,,,,,,,,,,,,Disagree,Ultrices! Vestibulum gravida lorem vel. Et. Porttitor erat! Neque accusamus.,Male,84764311,,
2017-11-26 20:45:37,2017-11-26 20:45:38,Survey Test,,100,1,True,2017-11-26 20:45:38,R_6J6inLrfuGPlswJ,,,,,47.720504760742,-122.20669555664,test,,Agree,Disagree,Strongly Agree,Agree,Undecided,Disagree,Undecided,Agree,Strongly Disagree,Disagree,Disagree,Strongly Disagree,Disagree,Agree,Disagree,Strongly Agree,Disagree,Disagree,Disagree,Agree,,,,,,,,,,,,,,,,,,,,,Undecided,"Elit wisi, vel. Eu magna neque vitae pharetra, metus placerat accusamus, lorem cras ultricies enim.",Male,14094423,,
2017-11-26 20:45:38,2017-11-26 20:45:39,Survey Test,,100,1,True,2017-11-26 20:45:39,R_6JV4YbF8pO2BWnP,,,,,47.720504760742,-122.20669555664,test,,Strongly Agree,Strongly Disagree,Disagree,Strongly Disagree,Strongly Disagree,Agree,Strongly Agree,Agree,Strongly Disagree,Agree,Strongly Agree,Undecided,Agree,Disagree,Strongly Disagree,Strongly Disagree,Disagree,Disagree,Strongly Agree,Disagree,,,,,,,,,,,,,,,,,,,,,Strongly Agree,Quis. Dui ullamcorper tellus ipsum. Vehicula vitae molestie suspendisse vitae sodales imperdiet? Vestibulum odio.,Male,51620384,,
2017-11-26 20:45:39,2017-11-26 20:45:40,Survey Test,,100,1,True,2017-11-26 20:45:40,R_3DeIhwBxtGapDI9,,,,,47.720504760742,-122.20669555664,test,,Strongly Disagree,Disagree,Agree,Agree,Strongly Agree,Disagree,Agree,Agree,Strongly Disagree,Strongly Agree,Disagree,Strongly Disagree,Strongly Disagree,Agree,Agree,Strongly Disagree,Disagree,Strongly Disagree,Agree,Strongly Disagree,,,,,,,,,,,,,,,,,,,,,Agree,"Per molestie orci metus tincidunt! Eleifend tempor, sit. Porttitor leo ipsum arcu? Suscipit, luctus.",Male,61434981,,
2017-11-27 16:39:42,2017-11-27 16:40:34,Survey Preview,,100,52,True,2017-11-27 16:40:35,R_2zOOxSEPfhmgjPc,,,,,47.720504760742,-122.20669555664,preview,EN,Disagree,Agree,,,Undecided,Strongly Agree,Disagree,,Strongly Agree,,,,,,,Agree,,,,,,,,,,,,,,,,,,,,,,,,,,1984,Male,11067508,Science,
2017-11-27 16:52:43,2017-11-27 16:53:26,Survey Preview,,100,42,True,2017-11-27 16:53:26,R_22lzs2sFlLWbiDP,,,,,47.720504760742,-122.20669555664,preview,EN,,,,,,,,,,,,,,,,,,,,,,,,,,,,,,,,,,,,,,,,,,,,82004956,PopCulture,
2017-11-27 17:48:32,2017-11-27 17:51:09,IP Address,66.192.183.244,100,157,True,2017-11-27 17:51:09,R_0U6b1BWxYy1vtHH,,,,,47.61540222168,-122.21029663086,anonymous,EN,Agree,Agree,Agree,Agree,Agree,Disagree,Agree,Agree,Undecided,Agree,Agree,Strongly Agree,Disagree,Disagree,Agree,Disagree,Undecided,Disagree,Undecided,Undecided,,,,,,,,,,,,,,,,,,,,,,1994,Female,79366779,Science,
2017-11-27 12:24:03,2017-11-27 13:56:30,IP Address,192.150.22.5,4,5546,False,2017-11-27 17:56:31,R_33D8m7Vo4mcBSGF,,,,,,,anonymous,EN,,,,,,,,,,,,,,,,,,,,,,,,,,,,,,,,,,,,,,,,,,,,54310802,,
2017-11-27 22:17:59,2017-11-27 22:40:07,IP Address,68.47.193.6,100,1328,True,2017-11-27 22:40:07,R_2aXOgFzn1CFL6Jc,,,,,35.889602661133,-86.316596984863,anonymous,EN,,,,,,,,,,,,,,,,,,,,,Undecided,Agree,Disagree,Undecided,Strongly Agree,Undecided,Agree,Agree,Disagree,Disagree,Disagree,Undecided,Agree,Undecided,Strongly Agree,Disagree,Agree,Agree,Agree,Undecided,,1988,Male,60384415,PopCulture,
2017-11-27 23:26:17,2017-11-27 23:29:05,IP Address,219.92.222.134,100,168,True,2017-11-27 23:29:06,R_2xSjzDyMo39XiJg,,,,,3.1788024902344,101.70449829102,anonymous,EN,Undecided,Strongly Agree,Agree,Strongly Agree,Undecided,Undecided,Disagree,Disagree,Strongly Disagree,Strongly Agree,Undecided,Strongly Disagree,Disagree,Agree,Disagree,Undecided,Agree,Agree,Agree,Agree,,,,,,,,,,,,,,,,,,,,,,1990,Male,46502510,Science,
2017-11-27 23:26:34,2017-11-27 23:29:11,IP Address,73.121.40.216,100,157,True,2017-11-27 23:29:12,R_2ZUOwTTvGvFPEli,,,,,36.265197753906,-82.833999633789,anonymous,EN,,,,,,,,,,,,,,,,,,,,,Strongly Agree,Undecided,Strongly Disagree,Disagree,Strongly Disagree,Strongly Agree,Strongly Agree,Undecided,Strongly Agree,Agree,Agree,Strongly Agree,Agree,Undecided,Agree,Disagree,Undecided,Undecided,Strongly Agree,Agree,,1993,Male,29130148,PopCulture,
2017-11-27 23:26:35,2017-11-27 23:29:24,IP Address,66.189.237.9,100,168,True,2017-11-27 23:29:24,R_e99Z7d4kZpxZR5f,,,,,36.63850402832,-89.525703430176,anonymous,EN,Strongly Agree,Strongly Agree,Strongly Agree,Strongly Agree,Strongly Disagree,Agree,Strongly Disagree,Strongly Agree,Strongly Disagree,Strongly Agree,Disagree,Strongly Disagree,Strongly Disagree,Strongly Disagree,Agree,Agree,Strongly Agree,Strongly Disagree,Agree,Agree,,,,,,,,,,,,,,,,,,,,,,1987,Male,71496854,Science,
2017-11-27 23:26:30,2017-11-27 23:29:42,IP Address,173.202.38.165,100,191,True,2017-11-27 23:29:42,R_2ANiEOPkNl7Sus6,,,,,35.482696533203,-91.491600036621,anonymous,EN,,,,,,,,,,,,,,,,,,,,,Strongly Disagree,Strongly Agree,Strongly Agree,Agree,Strongly Agree,Strongly Agree,Strongly Agree,Strongly Disagree,Strongly Agree,Strongly Disagree,Strongly Disagree,Undecided,Strongly Agree,Strongly Disagree,Strongly Agree,Disagree,Strongly Agree,Strongly Disagree,Strongly Agree,Strongly Agree,,1965,Male,42730345,PopCulture,
2017-11-27 23:28:24,2017-11-27 23:31:07,IP Address,173.168.226.248,100,163,True,2017-11-27 23:31:08,R_1jpQUg1CIqKBajh,,,,,28.006393432617,-82.59049987793,anonymous,EN,Undecided,Strongly Agree,Agree,Agree,Disagree,Agree,Agree,Agree,Strongly Disagree,Agree,Agree,Strongly Disagree,Agree,Disagree,Agree,Agree,Disagree,Agree,Disagree,Strongly Agree,,,,,,,,,,,,,,,,,,,,,,1997,Male,68862677,Science,
2017-11-27 23:27:06,2017-11-27 23:31:33,IP Address,72.177.9.86,100,267,True,2017-11-27 23:31:33,R_1rw4AGoIZVoRyJM,,,,,30.399993896484,-97.752799987793,anonymous,EN,,,,,,,,,,,,,,,,,,,,,Disagree,Disagree,Agree,Agree,Agree,Agree,Disagree,Agree,Agree,Undecided,Agree,Agree,Disagree,Disagree,Agree,Disagree,Disagree,Disagree,Agree,Agree,,1973,Female,24744013,PopCulture,
2017-11-27 23:30:29,2017-11-27 23:34:10,IP Address,184.174.185.10,100,220,True,2017-11-27 23:34:11,R_WoeXKXVGe38yfPX,,,,,35.300704956055,-85.180702209473,anonymous,EN,,,,,,,,,,,,,,,,,,,,,Undecided,Agree,Agree,Undecided,Agree,Undecided,Agree,Agree,Undecided,Disagree,Agree,Undecided,Disagree,Agree,Strongly Agree,Agree,Agree,Disagree,Disagree,Agree,,1969,Female,31751100,PopCulture,
2017-11-27 23:34:09,2017-11-27 23:35:27,IP Address,67.185.202.112,100,78,True,2017-11-27 23:35:28,R_1NFFcsQVccR03NO,,,,,47.634796142578,-117.25859832764,anonymous,EN,,,,,,,,,,,,,,,,,,,,,Agree,Disagree,Strongly Agree,Disagree,Strongly Agree,Agree,Strongly Agree,Strongly Agree,Agree,Agree,Strongly Disagree,Undecided,Strongly Agree,Undecided,Strongly Agree,Agree,Strongly Agree,Disagree,Strongly Agree,Undecided,,1989,Male,58348820,PopCulture,
2017-11-27 23:35:02,2017-11-27 23:36:51,IP Address,64.121.102.112,100,109,True,2017-11-27 23:36:51,R_3fABWkpeXxwGzDD,,,,,40.567794799805,-75.482803344727,anonymous,EN,,,,,,,,,,,,,,,,,,,,,Disagree,Disagree,Agree,Undecided,Strongly Disagree,Undecided,Agree,Agree,Agree,Strongly Agree,Disagree,Agree,Strongly Agree,Strongly Disagree,Strongly Agree,Agree,Agree,Agree,Disagree,Disagree,,1991,Male,53021021,PopCulture,
2017-11-27 23:34:43,2017-11-27 23:36:56,IP Address,76.97.235.209,100,132,True,2017-11-27 23:36:56,R_1Fh97u57RdoxRa0,,,,,34.024703979492,-84.503303527832,anonymous,EN,,,,,,,,,,,,,,,,,,,,,Strongly Agree,Disagree,Strongly Agree,Undecided,Strongly Agree,Undecided,Strongly Agree,Strongly Agree,Strongly Agree,Disagree,Disagree,Agree,Strongly Agree,Undecided,Agree,Agree,Agree,Undecided,Strongly Agree,Disagree,,1993,Male,29638061,PopCulture,
2017-11-27 23:34:28,2017-11-27 23:37:23,IP Address,73.40.21.219,100,175,True,2017-11-27 23:37:24,R_1zEJokFaUqOwfpT,,,,,37.290603637695,-80.101402282715,anonymous,EN,Agree,Disagree,Strongly Agree,Undecided,Undecided,Agree,Agree,Agree,Strongly Agree,Strongly Agree,Strongly Disagree,Undecided,Disagree,Undecided,Undecided,Agree,Undecided,Disagree,Disagree,Disagree,,,,,,,,,,,,,,,,,,,,,,1968,Female,79774328,Science,
2017-11-27 23:34:21,2017-11-27 23:37:42,IP Address,73.208.106.43,100,201,True,2017-11-27 23:37:42,R_2whig6Y2mWSdZgL,,,,,41.930999755859,-88.009002685547,anonymous,EN,Disagree,Agree,Agree,Agree,Agree,Agree,Disagree,Disagree,Disagree,Agree,Disagree,Disagree,Disagree,Agree,Agree,Disagree,Agree,Disagree,Agree,Disagree,,,,,,,,,,,,,,,,,,,,,,1974,Female,61244637,Science,
2017-11-27 23:36:08,2017-11-27 23:38:39,IP Address,74.65.197.210,100,150,True,2017-11-27 23:38:39,R_1jNhb7lbyxvJlEG,,,,,40.71110534668,-73.946899414062,anonymous,EN,Strongly Disagree,Strongly Agree,Undecided,Agree,Strongly Agree,Undecided,Disagree,Strongly Agree,Strongly Agree,Strongly Disagree,Strongly Disagree,Strongly Disagree,Strongly Disagree,Strongly Disagree,Undecided,Strongly Disagree,Agree,Undecided,Disagree,Strongly Disagree,,,,,,,,,,,,,,,,,,,,,,1985,Male,24220488,Science,
2017-11-27 23:31:15,2017-11-27 23:39:33,IP Address,70.124.32.115,100,497,True,2017-11-27 23:39:33,R_1dpghEv06jfJL8N,,,,,26.287399291992,-98.116798400879,anonymous,EN,Strongly Disagree,Undecided,Strongly Agree,Agree,Strongly Agree,Undecided,Strongly Agree,Agree,Disagree,Strongly Agree,Strongly Disagree,Agree,Strongly Disagree,Agree,Disagree,Agree,Disagree,Agree,Agree,Strongly Agree,,,,,,,,,,,,,,,,,,,,,,1988,Female,83621349,Science,
2017-11-27 23:36:36,2017-11-27 23:39:33,IP Address,67.2.211.161,100,176,True,2017-11-27 23:39:33,R_vN1LTYe28BMF84N,,,,,40.842102050781,-111.90560150146,anonymous,EN,,,,,,,,,,,,,,,,,,,,,Undecided,Strongly Agree,Agree,Undecided,Strongly Agree,Undecided,Undecided,Strongly Agree,Undecided,Disagree,Agree,Undecided,Disagree,Undecided,Agree,Disagree,Strongly Disagree,Disagree,Agree,Undecided,,1986,Male,67492942,PopCulture,
2017-11-27 23:37:00,2017-11-27 23:41:00,IP Address,24.11.254.28,100,240,True,2017-11-27 23:41:01,R_bNj6E0YQeZrHKa5,,,,,36.241195678711,-86.784599304199,anonymous,EN,,,,,,,,,,,,,,,,,,,,,Disagree,Disagree,Disagree,Disagree,Agree,Strongly Disagree,Agree,Undecided,Agree,Agree,Disagree,Disagree,Disagree,Agree,Agree,Disagree,Agree,Agree,Agree,Disagree,,1987,Female,78506569,PopCulture,
2017-11-27 23:42:10,2017-11-27 23:44:23,IP Address,174.221.2.129,100,132,True,2017-11-27 23:44:23,R_1E3ZXuVmAdXs1x9,,,,,41.696594238281,-87.663696289062,anonymous,EN,,,,,,,,,,,,,,,,,,,,,Undecided,Disagree,Agree,Strongly Agree,Disagree,Undecided,Agree,Agree,Agree,Agree,Disagree,Disagree,Disagree,Undecided,Disagree,Agree,Agree,Disagree,Agree,Agree,,1983,Female,43750911,PopCulture,
2017-11-27 23:42:27,2017-11-27 23:44:58,IP Address,116.44.98.16,100,150,True,2017-11-27 23:44:58,R_Dc9YleTKhZTrYtP,,,,,37.511199951172,126.97409057617,anonymous,EN,Disagree,Agree,Agree,Agree,Disagree,Agree,Disagree,Disagree,Disagree,Agree,Agree,Disagree,Agree,Disagree,Agree,Disagree,Agree,Agree,Agree,Strongly Agree,,,,,,,,,,,,,,,,,,,,,,1996,Male,88655551,Science,
2017-11-27 23:44:23,2017-11-27 23:47:06,IP Address,174.193.155.194,100,162,True,2017-11-27 23:47:07,R_2sYMp35Hz25ozQb,,,,,35.828506469727,-79.798400878906,anonymous,EN,Strongly Agree,Agree,Agree,Undecided,Undecided,Undecided,Strongly Agree,Undecided,Strongly Disagree,Strongly Agree,Undecided,Undecided,Strongly Disagree,Undecided,Undecided,Undecided,Undecided,Undecided,Undecided,Agree,,,,,,,,,,,,,,,,,,,,,,1979,Female,96577819,Science,
2017-11-27 23:46:35,2017-11-27 23:51:10,IP Address,189.135.176.34,100,274,True,2017-11-27 23:51:10,R_2COOtj4oGekGbCa,,,,,19.949996948242,-102.26670074463,anonymous,EN,,,,,,,,,,,,,,,,,,,,,Strongly Agree,Strongly Disagree,Strongly Disagree,Undecided,Strongly Disagree,Strongly Agree,Strongly Agree,Strongly Agree,Undecided,Undecided,Strongly Agree,Undecided,Undecided,Undecided,Undecided,Undecided,Undecided,Undecided,Strongly Disagree,Undecided,,1995,Male,31729791,PopCulture,
2017-11-27 23:51:10,2017-11-27 23:52:35,IP Address,24.140.17.10,100,85,True,2017-11-27 23:52:36,R_A1IZPO4qhZnua0p,,,,,40.818206787109,-81.491798400879,anonymous,EN,Disagree,Agree,Agree,Strongly Agree,Strongly Disagree,Strongly Disagree,Agree,Agree,Disagree,Strongly Agree,Strongly Agree,Strongly Agree,Disagree,Strongly Agree,Strongly Disagree,Agree,Strongly Agree,Disagree,Strongly Agree,Agree,,,,,,,,,,,,,,,,,,,,,,1983,Male,24215571,Science,
2017-11-27 23:48:41,2017-11-27 23:55:34,IP Address,174.30.3.170,100,412,True,2017-11-27 23:55:34,R_SQ4EAwdLYYapzJn,,,,,44.052093505859,-123.08670043945,anonymous,EN,Agree,Strongly Agree,Strongly Agree,Agree,Disagree,Disagree,Strongly Agree,Strongly Agree,Strongly Disagree,Strongly Agree,Strongly Agree,Agree,Strongly Agree,Agree,Agree,Strongly Disagree,Agree,Agree,Disagree,Disagree,,,,,,,,,,,,,,,,,,,,,,1981,Female,93153691,Science,
2017-11-27 23:52:22,2017-11-27 23:56:12,IP Address,104.174.145.72,100,229,True,2017-11-27 23:56:13,R_cveV1xRbJ4KICNH,,,,,33.934906005859,-118.36140441895,anonymous,EN,,,,,,,,,,,,,,,,,,,,,Undecided,Strongly Disagree,Strongly Agree,Strongly Disagree,Strongly Agree,Agree,Undecided,Strongly Agree,Strongly Agree,Strongly Agree,Strongly Disagree,Disagree,Strongly Agree,Strongly Agree,Strongly Agree,Strongly Agree,Disagree,Undecided,Strongly Agree,Agree,,1984,Male,92405096,PopCulture,
2017-11-27 23:54:43,2017-11-27 23:57:33,IP Address,24.113.4.88,100,169,True,2017-11-27 23:57:33,R_1Kyg2iy99H89AzS,,,,,47.99609375,-123.25189971924,anonymous,EN,Disagree,Agree,Strongly Disagree,Agree,Disagree,Disagree,Undecided,Agree,Disagree,Strongly Agree,Agree,Disagree,Disagree,Strongly Agree,Agree,Strongly Disagree,Agree,Agree,Undecided,Strongly Disagree,,,,,,,,,,,,,,,,,,,,,,1974,Male,93742603,Science,
2017-11-27 23:55:06,2017-11-27 23:58:05,IP Address,104.51.95.240,100,178,True,2017-11-27 23:58:06,R_3oF9b97adTM4K49,,,,,41.626998901367,-88.204002380371,anonymous,EN,,,,,,,,,,,,,,,,,,,,,Disagree,Disagree,Undecided,Disagree,Strongly Disagree,Undecided,Disagree,Strongly Agree,Undecided,Agree,Strongly Agree,Undecided,Disagree,Agree,Agree,Strongly Agree,Agree,Strongly Agree,Disagree,Strongly Agree,,1983,Male,86100441,PopCulture,
2017-11-27 23:57:23,2017-11-28 00:00:11,IP Address,107.77.228.150,100,168,True,2017-11-28 00:00:12,R_1CKqHc1u1cZkKUI,,,,,34.054397583008,-118.2440032959,anonymous,EN,Strongly Disagree,Strongly Disagree,Agree,Strongly Agree,Strongly Disagree,Agree,Agree,Disagree,Agree,Strongly Agree,Disagree,Agree,Strongly Disagree,Strongly Disagree,Agree,Agree,Strongly Disagree,Disagree,Disagree,Strongly Agree,,,,,,,,,,,,,,,,,,,,,,1991,Female,85803518,Science,
2017-11-28 00:04:19,2017-11-28 00:06:57,IP Address,187.250.86.199,100,158,True,2017-11-28 00:06:58,R_3FQLYxVZqHHYKQg,,,,,32.533294677734,-117.01670074463,anonymous,EN,,,,,,,,,,,,,,,,,,,,,Undecided,Agree,Strongly Disagree,Strongly Agree,Strongly Agree,Undecided,Undecided,Strongly Agree,Undecided,Agree,Strongly Agree,Strongly Agree,Strongly Disagree,Agree,Strongly Agree,Undecided,Undecided,Strongly Disagree,Agree,Strongly Agree,,1994,Female,38246829,PopCulture,
2017-11-28 00:11:51,2017-11-28 00:14:37,IP Address,66.76.210.149,100,166,True,2017-11-28 00:14:37,R_12seJW5TB3erAGf,,,,,30.653503417969,-97.582801818848,anonymous,EN,,,,,,,,,,,,,,,,,,,,,Disagree,Agree,Agree,Undecided,Agree,Undecided,Undecided,Strongly Agree,Agree,Disagree,Strongly Disagree,Undecided,Disagree,Undecided,Strongly Agree,Strongly Disagree,Undecided,Undecided,Undecided,Undecided,,1977,Male,39857189,PopCulture,
2017-11-28 00:13:18,2017-11-28 00:15:25,IP Address,172.89.78.59,100,126,True,2017-11-28 00:15:25,R_3NIhxE7zK4ESAIL,,,,,34.286804199219,-118.61399841309,anonymous,EN,Undecided,Undecided,Undecided,Strongly Agree,Undecided,Agree,Undecided,Disagree,Agree,Agree,Undecided,Strongly Agree,Disagree,Agree,Agree,Strongly Disagree,Undecided,Agree,Agree,Strongly Agree,,,,,,,,,,,,,,,,,,,,,,1991,Female,92326035,Science,
2017-11-28 00:14:55,2017-11-28 00:16:34,IP Address,172.103.25.6,100,99,True,2017-11-28 00:16:35,R_3EMWyRWj9emtFCJ,,,,,43.518997192383,-96.732200622559,anonymous,EN,Strongly Disagree,Strongly Disagree,Agree,Undecided,Strongly Agree,Agree,Strongly Agree,Strongly Agree,Strongly Disagree,Strongly Agree,Strongly Disagree,Disagree,Strongly Disagree,Disagree,Disagree,Strongly Disagree,Strongly Agree,Undecided,Disagree,Strongly Disagree,,,,,,,,,,,,,,,,,,,,,,1990,Male,79126297,Science,
2017-11-28 00:13:11,2017-11-28 00:20:35,IP Address,173.239.220.141,100,444,True,2017-11-28 00:20:36,R_SJcm8gqIhnxg8SZ,,,,,40.551605224609,-74.46369934082,anonymous,EN,Agree,Agree,Agree,Agree,Disagree,Strongly Agree,Strongly Agree,Agree,Agree,Agree,Agree,Disagree,Strongly Disagree,Disagree,Disagree,Strongly Disagree,Agree,Disagree,Disagree,Agree,,,,,,,,,,,,,,,,,,,,,,1981,Male,84019075,Science,
2017-11-28 00:16:29,2017-11-28 00:23:43,IP Address,75.219.207.151,100,434,True,2017-11-28 00:23:44,R_12KzWnzq7mSVoD2,,,,,37.751007080078,-97.821998596191,anonymous,EN,,,,,,,,,,,,,,,,,,,,,Agree,Agree,Strongly Agree,Strongly Agree,Strongly Agree,Strongly Agree,Undecided,Strongly Agree,Agree,Strongly Agree,Strongly Agree,Agree,Undecided,Agree,Strongly Agree,Undecided,Agree,Agree,Agree,Strongly Agree,,1963,Male,49540244,PopCulture,
2017-11-28 00:24:56,2017-11-28 00:26:36,IP Address,162.225.150.26,100,99,True,2017-11-28 00:26:36,R_10oTpR5PCCUAudT,,,,,37.622802734375,-122.43640136719,anonymous,EN,,,,,,,,,,,,,,,,,,,,,Agree,Undecided,Agree,Agree,Agree,Agree,Agree,Undecided,Agree,Undecided,Agree,Undecided,Agree,Undecided,Agree,Undecided,Undecided,Agree,Disagree,Undecided,,1994,Male,18802755,PopCulture,
2017-11-28 00:30:51,2017-11-28 00:33:01,IP Address,174.102.138.182,100,130,True,2017-11-28 00:33:02,R_31LyA6LP71yjnEQ,,,,,43.046005249023,-88.388900756836,anonymous,EN,,,,,,,,,,,,,,,,,,,,,Undecided,Disagree,Agree,Undecided,Strongly Disagree,Strongly Agree,Agree,Strongly Agree,Agree,Undecided,Strongly Disagree,Undecided,Agree,Agree,Undecided,Undecided,Undecided,Agree,Agree,Undecided,,1979,Female,93996617,PopCulture,
2017-11-28 00:31:14,2017-11-28 00:35:16,IP Address,172.77.253.176,100,242,True,2017-11-28 00:35:17,R_vTYDn0SZ4laMUHn,,,,,39.460205078125,-78.449203491211,anonymous,EN,Agree,Strongly Agree,Strongly Disagree,Agree,Undecided,Strongly Agree,Undecided,Agree,Strongly Disagree,Strongly Agree,Strongly Disagree,Undecided,Undecided,Disagree,Undecided,Strongly Agree,Undecided,Undecided,Undecided,Undecided,,,,,,,,,,,,,,,,,,,,,,1994,Female,62761241,Science,
